<!ELEMENT aptech (staff*, students*)>
<!ELEMENT staff (id , name , email)>
<!ELEMENT students (id , name , course)>
<!ELEMENT id (#PCDATA)>
<!ELEMENT name (#PCDATA)>
<!ELEMENT email (#PCDATA)>
<!ELEMENT course (#PCDATA)>
<!ATTLIST staff  department CDATA #REQUIRED>
